{"id":"synthetic.example","version":"0.1.0","api":1,"input":"binary-telemetry-v1","frames":[{"id":1536,"id_format":"standard","length":8,"role":"telemetry","signals":[{"name":"temperature","byte_offset":0,"type":"uint16","byte_order":"little","signed":true,"scale":0.1,"offset":-40,"unit":"degC","acquisition":"live","sentinels":[65535]},{"name":"pressure","byte_offset":6,"type":"uint16","byte_order":"big","signed":false,"scale":1,"offset":0,"unit":"kPa","acquisition":"live"}]},{"id":1537,"id_format":"standard","length":1,"role":"status","signals":[{"name":"status","byte_offset":0,"type":"uint8","byte_order":"little","signed":false,"scale":1,"offset":0,"unit":"dimensionless","acquisition":"held"}]}]}
